{
  "aggregate": {
    "bt_weight_bias": {
      "coherence": 1.15,
      "hero": 1.1,
      "persuasion": 1.05,
      "psycho": 0.95,
      "tech": 1.0,
      "ux": 1.0
    },
    "bt_weighted_score100": 59.1,
    "delta_vs_expected": 0.0,
    "expectedRawMax": 135,
    "linearScore100": 58.4,
    "pageTypeMultipliers": null,
    "rawMax": 135.0,
    "rawTotal": 78.81,
    "score100": 58.4,
    "weightedScore100": null
  },
  "applicability_overlay": {
    "applied": false,
    "bonus_hits": [],
    "business_type": "saas",
    "label": "weglot",
    "optional_flags": [],
    "page_type": "collection",
    "page_type_resolved": "collection",
    "removed_na": [],
    "required_hits": [],
    "rules_matched": [],
    "rules_matched_count": 0,
    "version": "1.0 (doctrine v3.2.0-draft)",
    "weight_bias": {
      "coherence": 1.15,
      "hero": 1.1,
      "persuasion": 1.05,
      "psycho": 0.95,
      "tech": 1.0,
      "ux": 1.0
    },
    "weighted_per_pillar": {
      "coherence": {
        "score100": 52.6,
        "weight": 1.15,
        "weighted_score100": 60.49
      },
      "hero": {
        "score100": 90.2,
        "weight": 1.1,
        "weighted_score100": 99.22
      },
      "persuasion": {
        "score100": 33.0,
        "weight": 1.05,
        "weighted_score100": 34.65
      },
      "psycho": {
        "score100": 60.0,
        "weight": 0.95,
        "weighted_score100": 57.0
      },
      "tech": {
        "score100": 78.0,
        "weight": 1.0,
        "weighted_score100": 78.0
      },
      "ux": {
        "score100": 63.6,
        "weight": 1.0,
        "weighted_score100": 63.6
      }
    }
  },
  "contextual_overlay": {
    "adjustments": [],
    "adjustments_count": 0,
    "applied": false,
    "by_pillar_delta": {},
    "group_stats": {
      "BENEFIT_FLOW": {
        "max_score": 3.0,
        "mean_score": 1.07,
        "members_present": 7,
        "min_score": 0.0,
        "sigma": 1.05
      },
      "COHERENCE_FULL": {
        "max_score": 3.0,
        "mean_score": 1.52,
        "members_present": 7,
        "min_score": 0.0,
        "sigma": 1.05
      },
      "EMOTIONAL_DRIVERS": {
        "max_score": 3.0,
        "mean_score": 2.25,
        "members_present": 4,
        "min_score": 1.5,
        "sigma": 0.75
      },
      "HERO_ENSEMBLE": {
        "max_score": 3.0,
        "mean_score": 2.71,
        "members_present": 6,
        "min_score": 1.98,
        "sigma": 0.42
      },
      "SOCIAL_PROOF_STACK": {
        "max_score": 1.35,
        "mean_score": 0.8,
        "members_present": 3,
        "min_score": 0.0,
        "sigma": 0.58
      },
      "TECH_FOUNDATION": {
        "max_score": 3.0,
        "mean_score": 2.34,
        "members_present": 5,
        "min_score": 1.8,
        "sigma": 0.54
      },
      "VISUAL_HIERARCHY": {
        "max_score": 3.0,
        "mean_score": 2.36,
        "members_present": 4,
        "min_score": 1.5,
        "sigma": 0.66
      }
    },
    "perception_available": true,
    "rules_fired": [],
    "total_delta": 0,
    "version": "1.0 (doctrine v3.2.0-draft)"
  },
  "doctrineVersion": "v3.2.0-draft — doctrine V13 — 2026-04-18 (ensemble-aware)",
  "exclusions": {
    "applied": [
      "coh_03",
      "per_02",
      "psy_03",
      "psy_04",
      "psy_05",
      "ux_06"
    ],
    "count": 6,
    "reasons": {
      "coh_03": "Pas d'alignement ad→LP direct sur une collection",
      "per_02": "Le storytelling narratif n'a pas sa place sur une page collection (c'est de la navigation)",
      "psy_03": "Pas de scarcité/urgence sur une catégorie",
      "psy_04": "Pas d'ancrage prix sur une catégorie (c'est au niveau PDP)",
      "psy_05": "Pas de loss aversion sur une page de navigation",
      "ux_06": "La navigation full est nécessaire sur une collection"
    }
  },
  "label": "weglot",
  "maxPerPageType": {
    "rawMax": 135,
    "scoreBase": 100,
    "specific": 4,
    "total": 45,
    "universal": 41
  },
  "notes": [
    "Universal criteria are filtered post-scorer using page_type_criteria.json.universalExclusions.",
    "Specific criteria are scored by score_specific_criteria.py (35 detectors + LLM-review fallback).",
    "Dual-viewport aggregation is delegated to bloc scorers' own viewport_check logic.",
    "delta_vs_expected should be ≈ 0 once all bloc scorers expose criterion IDs cleanly.",
    "Semantic overlay (v1.0, 2026-04-18): Haiku scores replace regex for 18 creative criteria when score_semantic.json exists. Each kept_criterion with method='semantic_haiku' also stores regex_score/regex_verdict for traceability. Pillar rawTotal / score100 are recomputed post-overlay; aggregate follows.",
    "Contextual overlay (P1.B, doctrine v3.2.0-draft, 2026-04-18): ENSEMBLE-scope criteria may be rescued upwards by strong peers in the same synergy group (HERO_ENSEMBLE, BENEFIT_FLOW, SOCIAL_PROOF_STACK…) or penalized for contradictions (manipulation flag: urgency without risk reversal). Each affected kept_criterion records pre_contextual_score/tier + contextual_rule + rationale. ASSET-scope criteria (tech_*, counts) are INVARIANT."
  ],
  "pageType": "collection",
  "semantic_overlay": {
    "applied": true,
    "by_pillar_delta": {
      "coherence": 0.0,
      "hero": 0.0,
      "persuasion": -0.3,
      "psycho": -4.5,
      "tech": 0.0,
      "ux": 0.0
    },
    "criteria_count": 8,
    "criteria_overridden": [
      {
        "delta": 0.0,
        "id": "hero_02",
        "pillar": "hero",
        "regex_score": 3.0,
        "semantic_score": 3.0,
        "verdict": "top"
      },
      {
        "delta": 1.2,
        "id": "per_01",
        "pillar": "persuasion",
        "regex_score": 1.8,
        "semantic_score": 3.0,
        "verdict": "top"
      },
      {
        "delta": 0.0,
        "id": "per_03",
        "pillar": "persuasion",
        "regex_score": 1.5,
        "semantic_score": 1.5,
        "verdict": "ok"
      },
      {
        "delta": 0.0,
        "id": "per_07",
        "pillar": "persuasion",
        "regex_score": 1.5,
        "semantic_score": 1.5,
        "verdict": "ok"
      },
      {
        "delta": -1.5,
        "id": "per_08",
        "pillar": "persuasion",
        "regex_score": 3.0,
        "semantic_score": 1.5,
        "verdict": "ok"
      },
      {
        "delta": 0.0,
        "id": "psy_01",
        "pillar": "psycho",
        "regex_score": 1.5,
        "semantic_score": 1.5,
        "verdict": "ok"
      },
      {
        "delta": -1.5,
        "id": "psy_02",
        "pillar": "psycho",
        "regex_score": 3.0,
        "semantic_score": 1.5,
        "verdict": "ok"
      },
      {
        "delta": -3.0,
        "id": "psy_08",
        "pillar": "psycho",
        "regex_score": 3.0,
        "semantic_score": 0.0,
        "verdict": "critical"
      }
    ],
    "model": "claude-haiku-4-5-20251001",
    "semantic_criteria_available": [
      "coh_01",
      "coh_02",
      "coh_03",
      "coh_05",
      "hero_01",
      "hero_02",
      "hero_04",
      "hero_05",
      "hero_06",
      "per_01",
      "per_02",
      "per_03",
      "per_07",
      "per_08",
      "psy_01",
      "psy_02",
      "psy_05",
      "psy_08"
    ],
    "total_delta": -4.8,
    "version": "1.0"
  },
  "specific": {
    "rawMax": 12,
    "rawTotal": 6.0,
    "result": {
      "doctrineVersion": "v3.1.0 — doctrine V12 — 2026-04-13",
      "maxPerPageType": {
        "rawMax": 135,
        "scoreBase": 100,
        "specific": 4,
        "total": 45,
        "universal": 41
      },
      "pageType": "collection",
      "rawMax": 12,
      "rawTotal": 6.0,
      "results": [
        {
          "confidence": "medium",
          "id": "col_01",
          "label": "Filtres et tri fonctionnels et pertinents (prix, taille, type, note, best-sellers)",
          "pillar": "ux",
          "proof": {},
          "score": 1.5,
          "signal": "145 produits visibles",
          "tier": "ok",
          "viewport_check": null
        },
        {
          "confidence": "high",
          "id": "col_02",
          "label": "Vignettes produit informatives (image, nom, prix, note, badge promo visible)",
          "pillar": "persuasion",
          "proof": {},
          "score": 0.0,
          "signal": "Pas de filtres — collection non filtrable",
          "tier": "critical",
          "viewport_check": null
        },
        {
          "confidence": "high",
          "id": "col_03",
          "label": "Description catégorie SEO-friendly en haut de page (contexte + mots-clés)",
          "pillar": "tech",
          "proof": {
            "signals": [
              "class=\"[^\"]*pagination"
            ]
          },
          "score": 3.0,
          "signal": "Pagination/load-more détecté (1)",
          "tier": "top",
          "viewport_check": null
        },
        {
          "confidence": "low",
          "id": "col_04",
          "label": "Nombre de résultats affiché + pagination ou infinite scroll fonctionnel",
          "pillar": "ux",
          "proof": {
            "reason": "No automated detector; deferred to Layer 2 perception (screenshot + DOM analysis)"
          },
          "requires_llm_evaluation": true,
          "score": 1.5,
          "signal": "requires_llm_evaluation",
          "tier": "ok",
          "viewport_check": null
        }
      ],
      "reviewRequiredCount": 1,
      "score100": 50.0,
      "specificCount": 4
    },
    "reviewRequiredCount": 1,
    "score100": 50.0
  },
  "universal": {
    "byPillar": {
      "coherence": {
        "applicability_delta_rawMax": 0.0,
        "applicability_delta_rawTotal": 0.0,
        "applicability_removed_count": 0,
        "applied_exclusions": [
          "coh_03"
        ],
        "bloc": "coherence",
        "kept_criteria": [
          {
            "_intelligence_lift": null,
            "_vision_lift": {
              "new_score": 3,
              "old_score": 0,